[
  {
    "id": "7b579797-f6f4-4bd3-8888-3ccbbf605b4d",
    "type": "MCQ",
    "content": [
      {
        "type": "paragraph",
        "inlines": [
          {
            "type": "text",
            "text": "If "
          },
          {
            "type": "math",
            "latex": "2\\begin{bmatrix}3 & 4 \\\\ 5 & x\\end{bmatrix} + \\begin{bmatrix}1 & y \\\\ 0 & 1\\end{bmatrix} = \\begin{bmatrix}7 & 0 \\\\ 10 & 5\\end{bmatrix}",
            "display": false
          },
          {
            "type": "text",
            "text": ", then the value of "
          },
          {
            "type": "math",
            "latex": "x-y",
            "display": false
          },
          {
            "type": "text",
            "text": " is :"
          }
        ]
      }
    ],
    "options": {
      "A": [
        {
          "type": "paragraph",
          "inlines": [
            {
              "type": "text",
              "text": "3"
            }
          ]
        }
      ],
      "B": [
        {
          "type": "paragraph",
          "inlines": [
            {
              "type": "text",
              "text": "1"
            }
          ]
        }
      ],
      "C": [
        {
          "type": "paragraph",
          "inlines": [
            {
              "type": "text",
              "text": "10"
            }
          ]
        }
      ],
      "D": [
        {
          "type": "paragraph",
          "inlines": [
            {
              "type": "text",
              "text": "8"
            }
          ]
        }
      ]
    },
    "answer": "C",
    "marks": 1,
    "group_id": null,
    "tags": [
      "Algebra",
      "Matrices & Determinants",
      "Easy",
      "cuet-mathematics-2022-slot-8-17-aug-shift-2"
    ],
    "source": {
      "title": "cuet-mathematics-2022-slot-8-17-aug-shift-2",
      "question_number": 1
    },
    "review_status": "NEEDS_REVIEW",
    "publication_status": "DRAFT"
  },
  {
    "id": "5c08f115-cfac-428f-bd3d-ac4a25177fd5",
    "type": "MCQ",
    "content": [
      {
        "type": "paragraph",
        "inlines": [
          {
            "type": "text",
            "text": "If "
          },
          {
            "type": "math",
            "latex": "A=\\begin{bmatrix}2 & 0 & 0 \\\\ -1 & 2 & 3 \\\\ 3 & 3 & 5\\end{bmatrix}",
            "display": false
          },
          {
            "type": "text",
            "text": ", then "
          },
          {
            "type": "math",
            "latex": "A(\\text{adj } A)",
            "display": false
          },
          {
            "type": "text",
            "text": " is equal to :"
          }
        ]
      }
    ],
    "options": {
      "A": [
        {
          "type": "paragraph",
          "inlines": [
            {
              "type": "math",
              "latex": "\\begin{bmatrix}3 & 3 & 3 \\\\ 3 & 3 & 3 \\\\ 3 & 3 & 3\\end{bmatrix}",
              "display": false
            }
          ]
        }
      ],
      "B": [
        {
          "type": "paragraph",
          "inlines": [
            {
              "type": "math",
              "latex": "\\begin{bmatrix}3 & 0 & 0 \\\\ 0 & 3 & 0 \\\\ 0 & 0 & 3\\end{bmatrix}",
              "display": false
            }
          ]
        }
      ],
      "C": [
        {
          "type": "paragraph",
          "inlines": [
            {
              "type": "math",
              "latex": "\\begin{bmatrix}2 & 0 & 0 \\\\ 0 & 2 & 0 \\\\ 0 & 0 & 2\\end{bmatrix}",
              "display": false
            }
          ]
        }
      ],
      "D": [
        {
          "type": "paragraph",
          "inlines": [
            {
              "type": "math",
              "latex": "\\begin{bmatrix}1 & 0 & 0 \\\\ 0 & 1 & 0 \\\\ 0 & 0 & 1\\end{bmatrix}",
              "display": false
            }
          ]
        }
      ]
    },
    "answer": "C",
    "marks": 1,
    "group_id": null,
    "tags": [
      "Algebra",
      "Matrices & Determinants",
      "Medium",
      "cuet-mathematics-2022-slot-8-17-aug-shift-2"
    ],
    "source": {
      "title": "cuet-mathematics-2022-slot-8-17-aug-shift-2",
      "question_number": 2
    },
    "review_status": "NEEDS_REVIEW",
    "publication_status": "DRAFT"
  },
  {
    "id": "606a5497-ec0b-4817-8403-94369e72c49c",
    "type": "MCQ",
    "content": [
      {
        "type": "paragraph",
        "inlines": [
          {
            "type": "text",
            "text": "The area (in square units) bounded by the curve "
          },
          {
            "type": "math",
            "latex": "y^2 = 4x",
            "display": false
          },
          {
            "type": "text",
            "text": " and the line "
          },
          {
            "type": "math",
            "latex": "x=1",
            "display": false
          },
          {
            "type": "text",
            "text": " is :"
          }
        ]
      }
    ],
    "options": {
      "A": [
        {
          "type": "paragraph",
          "inlines": [
            {
              "type": "math",
              "latex": "\\frac{4}{3}",
              "display": false
            }
          ]
        }
      ],
      "B": [
        {
          "type": "paragraph",
          "inlines": [
            {
              "type": "math",
              "latex": "\\frac{8}{3}",
              "display": false
            }
          ]
        }
      ],
      "C": [
        {
          "type": "paragraph",
          "inlines": [
            {
              "type": "math",
              "latex": "\\frac{11}{3}",
              "display": false
            }
          ]
        }
      ],
      "D": [
        {
          "type": "paragraph",
          "inlines": [
            {
              "type": "math",
              "latex": "\\frac{16}{3}",
              "display": false
            }
          ]
        }
      ]
    },
    "answer": "B",
    "marks": 1,
    "group_id": null,
    "tags": [
      "Calculus",
      "Application of Integrals",
      "Easy",
      "cuet-mathematics-2022-slot-8-17-aug-shift-2"
    ],
    "source": {
      "title": "cuet-mathematics-2022-slot-8-17-aug-shift-2",
      "question_number": 3
    },
    "review_status": "NEEDS_REVIEW",
    "publication_status": "DRAFT"
  },
  {
    "id": "891035db-d156-438a-be3a-9f8f22825519",
    "type": "MCQ",
    "content": [
      {
        "type": "paragraph",
        "inlines": [
          {
            "type": "text",
            "text": "If "
          },
          {
            "type": "math",
            "latex": "x = \\begin{vmatrix}1 & 2 & 3 \\\\ 2 & 3 & 1 \\\\ 3 & 1 & 2\\end{vmatrix}",
            "display": false
          },
          {
            "type": "text",
            "text": " then value of "
          },
          {
            "type": "math",
            "latex": "9-2x",
            "display": false
          },
          {
            "type": "text",
            "text": " is :"
          }
        ]
      }
    ],
    "options": {
      "A": [
        {
          "type": "paragraph",
          "inlines": [
            {
              "type": "text",
              "text": "27"
            }
          ]
        }
      ],
      "B": [
        {
          "type": "paragraph",
          "inlines": [
            {
              "type": "math",
              "latex": "-36",
              "display": false
            }
          ]
        }
      ],
      "C": [
        {
          "type": "paragraph",
          "inlines": [
            {
              "type": "text",
              "text": "45"
            }
          ]
        }
      ],
      "D": [
        {
          "type": "paragraph",
          "inlines": [
            {
              "type": "math",
              "latex": "-54",
              "display": false
            }
          ]
        }
      ]
    },
    "answer": "C",
    "marks": 1,
    "group_id": null,
    "tags": [
      "Algebra",
      "Matrices & Determinants",
      "Easy",
      "cuet-mathematics-2022-slot-8-17-aug-shift-2"
    ],
    "source": {
      "title": "cuet-mathematics-2022-slot-8-17-aug-shift-2",
      "question_number": 4
    },
    "review_status": "NEEDS_REVIEW",
    "publication_status": "DRAFT"
  },
  {
    "id": "956e6415-580a-41c8-81ce-c0ae5cd139a1",
    "type": "MCQ",
    "content": [
      {
        "type": "paragraph",
        "inlines": [
          {
            "type": "text",
            "text": "Consider the linear programming problem :"
          }
        ]
      },
      {
        "type": "paragraph",
        "inlines": [
          {
            "type": "text",
            "text": "Minimize "
          },
          {
            "type": "math",
            "latex": "z = 50x + 70y",
            "display": false
          }
        ]
      },
      {
        "type": "paragraph",
        "inlines": [
          {
            "type": "text",
            "text": "Subject to "
          },
          {
            "type": "math",
            "latex": "2x+y \\geq 8",
            "display": false
          },
          {
            "type": "text",
            "text": ", "
          },
          {
            "type": "math",
            "latex": "x+2y \\geq 10",
            "display": false
          },
          {
            "type": "text",
            "text": ", "
          },
          {
            "type": "math",
            "latex": "x \\geq 0",
            "display": false
          },
          {
            "type": "text",
            "text": ", "
          },
          {
            "type": "math",
            "latex": "y \\geq 0",
            "display": false
          }
        ]
      },
      {
        "type": "paragraph",
        "inlines": [
          {
            "type": "text",
            "text": "The minimum value of objective function is :"
          }
        ]
      }
    ],
    "options": {
      "A": [
        {
          "type": "paragraph",